{
  "run_id": "accuracy_20260402T024225Z",
  "lane": "accuracy",
  "created_at": "2026-04-02T02:42:25.947311+00:00",
  "git_commit": "d77b944e088ff3a27e8b49a68a5e784a967bbbe3",
  "candidate": {
    "path": "experiments/0005-conversational-archive/src/prompts.py",
    "artifact_type": "prompts",
    "notes": ""
  },
  "benchmarks": {
    "set_id": "qa_holdout_v1",
    "split": "holdout"
  },
  "snapshots": {
    "catalog_id": "cat_20260401T1800Z",
    "synthesis_id": "syn_20260401T1812Z",
    "manifests_id": null
  },
  "preflight": {
    "status": "pass",
    "notes": ""
  },
  "metrics": {
    "baseline": null,
    "candidate": null,
    "holdout": null
  },
  "verdict": {
    "status": "incomplete",
    "reason": "Scaffold only; benchmark not executed yet."
  },
  "artifacts": {
    "scores_json": "scores.json",
    "preflight_json": "preflight.json",
    "diff_patch": null,
    "trace_dir": null
  }
}
